"id","id_proceso","id_resultado","fecha_hora_inicio","fecha_hora_fin","anotaciones"
"283","33","1","2025-06-24 08:00:00","2025-06-24 09:30:00","El corte de tela fue realizado de manera eficiente y precisa, y todas las piezas necesarias fueron obtenidas sin defectos."
"284","33","2","2025-06-25 09:00:00","2025-06-25 10:00:00","El corte fue aceptable, aunque hubo algunos errores menores en la alineación del patrón, lo que llevó a pequeños ajustes."
"285","33","3","2025-06-26 08:00:00","2025-06-26 09:30:00","El corte de tela fue defectuoso. La tela se estiró y algunas partes no se cortaron correctamente, lo que requirió un nuevo corte."
"286","33","1","2025-06-27 08:00:00","2025-06-27 09:30:00","El corte de tela se completó con éxito y la tela fue perfectamente ajustada al patrón, lista para la siguiente fase."
"287","33","2","2025-06-28 08:30:00","2025-06-28 10:00:00","El corte fue satisfactorio, pero algunas partes de la tela no quedaron bien alineadas, lo que requeriría un pequeño ajuste posterior."
"288","33","3","2025-06-29 08:00:00","2025-06-29 09:30:00","Hubo un gran error en el corte de tela, donde se produjeron varios desgarros. Fue necesario rehacer el corte de todas las piezas."
"289","33","1","2025-06-30 08:00:00","2025-06-30 09:30:00","Corte de tela realizado con éxito. No hubo errores y todas las piezas fueron cortadas perfectamente de acuerdo con el diseño."
"290","34","1","2025-07-01 08:00:00","2025-07-01 10:30:00","La costura se realizó correctamente, las piezas encajaron bien y la blusa adquirió su forma final."
"291","34","2","2025-07-02 08:30:00","2025-07-02 10:00:00","Durante la costura, se produjeron algunos desajustes en los detalles del cuello, pero fueron corregidos sin mayores inconvenientes."
"292","34","3","2025-07-03 08:00:00","2025-07-03 09:30:00","Hubo problemas con la costura de la blusa, ya que la tela se desgarró en varias partes debido a la tensión incorrecta de la máquina. Se requirió deshacer y volver a coser."
"293","34","1","2025-07-04 08:00:00","2025-07-04 10:00:00","La costura se completó con éxito, las costuras fueron sólidas y la blusa pasó a la siguiente fase sin problemas."
"294","34","2","2025-07-05 08:00:00","2025-07-05 09:30:00","Aunque la costura fue generalmente exitosa, se notaron algunos pequeños errores en el dobladillo que necesitaron ajustes menores."
"295","34","3","2025-07-06 08:00:00","2025-07-06 09:00:00","La costura de la blusa no fue exitosa debido a que hubo varios problemas con el hilo y la máquina de coser. Se hizo necesario reiniciar el proceso."
"296","34","1","2025-07-07 08:00:00","2025-07-07 10:00:00","Costura exitosa, todos los detalles de la blusa fueron cosidos correctamente y la pieza quedó lista para la revisión final."
"297","34","2","2025-07-08 08:00:00","2025-07-08 10:00:00","La costura fue generalmente buena, pero algunos detalles finos no fueron cosidos con precisión y fueron corregidos."
"298","34","3","2025-07-09 08:30:00","2025-07-09 10:00:00","Hubo múltiples fallos en la costura, particularmente en los bordes, lo que hizo necesario rehacer las costuras de la blusa."
"299","34","1","2025-07-10 08:00:00","2025-07-10 10:30:00","La costura se completó con éxito y todos los detalles de la blusa fueron verificados y aprobados."
"300","35","1","2025-07-11 08:00:00","2025-07-11 10:00:00","El control de calidad se realizó correctamente, la blusa cumple con todos los estándares de calidad establecidos."
"301","35","2","2025-07-12 08:00:00","2025-07-12 10:30:00","El control de calidad fue satisfactorio, pero se encontraron algunos hilos sueltos que fueron corregidos antes de la aprobación final."
"302","35","3","2025-07-13 08:00:00","2025-07-13 09:30:00","El control de calidad no fue satisfactorio. Se encontraron defectos en la costura y el dobladillo, lo que resultó en una revaluación completa del producto."
"303","35","1","2025-07-14 08:00:00","2025-07-14 10:00:00","La blusa pasó todos los controles de calidad sin problemas. El producto es apto para el embalaje y envío."
"304","35","2","2025-07-15 08:30:00","2025-07-15 10:00:00","Durante el control de calidad, algunos detalles de la blusa no fueron perfectos, pero fueron corregidos sin retrasar el proceso."
"305","35","3","2025-07-16 08:00:00","2025-07-16 09:00:00","Hubo varios problemas durante el control de calidad, incluyendo defectos en el tejido y el mal acabado de la costura, lo que llevó a un rechazo de la pieza."
"306","35","1","2025-07-17 08:00:00","2025-07-17 09:30:00","El control de calidad fue satisfactorio y la blusa fue aprobada para continuar al proceso de embalaje y envío."
"307","35","2","2025-07-18 08:00:00","2025-07-18 09:30:00","La blusa pasó la mayoría de las pruebas de calidad, pero hubo pequeños defectos que no comprometían la calidad general del producto."
"308","35","3","2025-07-19 08:00:00","2025-07-19 09:30:00","La pieza fue rechazada durante el control de calidad debido a fallos graves en la tela, especialmente en las costuras de la parte inferior de la blusa."
"309","35","1","2025-07-20 08:00:00","2025-07-20 10:00:00","La blusa pasó todas las pruebas de calidad sin problemas y se consideró lista para la fase de embalaje y envío."
"310","36","1","2025-07-21 08:00:00","2025-07-21 09:30:00","El embalaje y envío de la blusa se completó sin problemas. La blusa fue cuidadosamente empaquetada y enviada a su destino."
"311","36","2","2025-07-22 08:30:00","2025-07-22 10:00:00","El embalaje fue satisfactorio, pero hubo un pequeño retraso en la recolección del paquete debido a problemas con la logística de envío."
"312","36","3","2025-07-23 08:00:00","2025-07-23 09:30:00","El proceso de embalaje y envío no fue satisfactorio debido a un error en la dirección de envío, lo que causó un retraso significativo."
"313","36","1","2025-07-24 08:00:00","2025-07-24 09:30:00","El embalaje fue completado con éxito y el producto fue enviado correctamente a su destino sin problemas."
"314","36","2","2025-07-25 08:00:00","2025-07-25 09:30:00","El embalaje y envío fueron satisfactorios, pero el paquete sufrió un pequeño daño durante el transporte, lo cual fue documentado para su revisión."
"315","36","3","2025-07-26 08:00:00","2025-07-26 09:00:00","Hubo problemas durante el embalaje debido a un error en el etiquetado, lo que llevó a que el paquete fuera enviado a la dirección incorrecta."
"316","36","1","2025-07-27 08:00:00","2025-07-27 09:30:00","El embalaje y el envío fueron realizados con éxito, sin ningún inconveniente, y la blusa llegó a tiempo."
"317","36","2","2025-07-28 08:00:00","2025-07-28 09:30:00","El embalaje fue adecuado, pero la blusa sufrió pequeños daños en el proceso de manipulación, lo que requirió reparaciones menores antes de ser enviada."
"318","36","3","2025-07-29 08:00:00","2025-07-29 09:30:00","El proceso de embalaje y envío falló debido a un error de logística que causó que el paquete no fuera enviado dentro del tiempo previsto."
"319","36","1","2025-07-30 08:00:00","2025-07-30 09:30:00","El embalaje fue realizado de manera eficiente y la blusa fue enviada correctamente sin ningún error."
